id	speaker	sex	text	label
gb33659	f05f7903faa9db250ec49cebce8888b2	M	"(Urgent Question): To ask the Secretary of State for Education if she will make a statement on the recent decision by the High Court on the right of parents to take their children on holiday during term time.


I thank the Minister for his answer. However, there is another aspect to the policy which, sadly, has been ignored up till now—the economic impact of the policy on tourist areas, particularly in Cornwall. In 2014 a published report indicated that the tourist industry in Cornwall had lost £50 million as a result

With respect to the Minister, there is no prospect of social mobility for a family if the parents lose their job or have their hours cut because of the downturn in the tourism industry and the way that that affects their jobs. Is it not the case that only 8% of school absenteeism is a result of family holidays? There is no drop-off in the attainment of those children. Family holidays are good for children. They widen their knowledge of the world and expose them to new experiences, and children whose family take them on a holiday often perform better as a direct result

Will the Minister please look at the matter again? If he is going to bring forward measures to tighten the rules or strengthen them, can he assure the House that there will be a full debate in this Chamber, that the changes to the rules will not be made through secondary legislation, that this time a full impact assessment will be carried out that includes the economic impact on tourism-related industries, that the family test will be applied to the measures, and that a full public consultation will take place that considers the impact on all stakeholders—not just education, but the wider society and families especially?"	0
gb57585	375432d1374ab72032eef3216442fd66	F	"My Lords, the noble Lord, Lord Hunt, introduced his Amendment 144B on complaints about care services very well. He is absolutely right: this is a muddle. Are people to go to the CQC or to a particular home when they wish to make a complaint? Any complaints system where the person making the complaint feels in a less strong position than the organisation to which they are complaining, or indeed—sometimes they might even put this strongly—which is wielding power over them is a complaints system that will not work. I hope that the Minister will understand this, and will respond and ensure, first, that there is a clear and understood system, and, secondly, that if some funding needs to be restored to the CQC to take us back to where we were, that will happen

I want to speak particularly to two of the issues covered in this wide-ranging group of amendments: the licensing of cosmetic procedures and medical practitioners’ financial and non-pecuniary interests. I also have sympathy for the other two, on registration of social workers and hospital rehabilitation accommodation

The amendments laid by the Minister, beginning with 153A, on the licensing of cosmetic procedures by local authorities and, indeed, Amendment 169 in the name of the noble Baroness, Lady Finlay, on cosmetic procedures, which I have signed, set out models for registration for those who work using devices that breach the skin and who are not covered by medical registration or, currently, by any effective regulation. I know that considerable discussions have taken place between Committee and Report, and it is welcome that the Government have felt that they can now lay their own amendments, signed by the noble Baroness, Lady Merron, and the noble Lord, Lord Lansley. I look forward to hearing the comments of the noble Baroness, Lady Finlay, on those amendments

Amendment 184ZBB in the name of the noble Baroness, Lady Cumberlege, which I have signed, brings us back to the debate on medical practitioners’ financial and non-pecuniary interests. Our debate in Committee highlighted the problem that the financial and non-pecuniary interests arrangements do not match those that many others in the public sector have to make, where the registration body holds the information. The GMC has said once again that it does not particularly like the style of this amendment and would prefer the records to be held directly by the employer. However, I believe the argument that the registration body, which also has the power to take action, should be the place where these are kept

I hope that, regardless of whether a vote is called, the Minister will take this away and look at it in more detail. We need an open, transparent and clear system of registration of financial and non-pecuniary interests."	1
gb41375	25ae6f61c00e26a7af7b44fd25e8b3df	M	My Lords, over a number of months we have listened to many speeches in this House on the Irish border. While I listened to them I wondered whether the speakers were serious about trying to resolve the issue or whether it was another way of stopping Brexit. I listened to the noble Lord, Lord Patten, opening the debate, and heard some laughter around the Chamber. I can assure noble Lords in this House that this is no laughing matter. The question of how the Irish border issue might be resolved is a serious one. If your Lordships listen to the Peers from Northern Ireland, there is almost unity of purpose today. We are on the ground in Northern Ireland and we know what people are thinking on this issue.	1
gb43653	2388874a62a0774a837663f126fc8836	F	The Government have rightly exempted vulnerable road users from the proposed changes. However, two colleagues—say, two paramedics or two police officers—who are both injured at work on the roads could be treated quite differently, with one able to get legal advice and pay no cost to get compensation, and one having to fight insurers on their own, simply because one was injured on a motorbike and the other in an ambulance or squad car. Rather than hold working people to different standards, can the Government exempt all people injured in the course of their work?	1
gb56620	d5bf0b1ee717c3a5b8bf9856e5c33781	F	"My Lords, I am very keen to speak to these amendments. This is the first time I have been able to contribute to this Bill, and I apologise for not being here for Second Reading. I was actually talking to Members of the Scottish Parliament about NICE and SIGN guidelines on the day of Second Reading, so I am delighted to have an opportunity to contribute now. I will speak to Amendments 17, 205 and 301. I thank my noble friend Lady Morgan of Cotes for tabling them; I would have added my name to all three if I had got in quick enough

We all appreciate that health and care are devolved matters. As my noble friend outlined, the Scottish Administration have taken a very different path on health and care over recent years, which perhaps could be characterised as worrying less about long-term funding and pursuing a more centralised approach. The Bill is therefore predominantly and rightly focused on matters relating to England, but a number of clauses addressed by these amendments relate to devolved areas. I note that the Scottish Government and the Cabinet Secretary for Health in Scotland have yet to grant the Bill legislative consent, believing that some clauses do not reflect the devolution agreement. I beg to put that these amendments are slightly different, in that they do not cover a specific area of delivery within devolved nations

Amendment 17 simply covers how NHS England should consider the impact of any decisions it might make on patient outcomes in the devolved Administrations. Amendment 205 protects the right of access to treatment and services for all citizens throughout the UK. Amendment 301 seems to be simple common sense, in that it ensures the interoperability of data and collection of comparable healthcare statistics across the UK

I support these amendments on a number of counts. First, the pandemic has highlighted the huge importance of good data, and close collaboration and working, throughout all health and care services in all parts of the UK—whether that is knowledge gathering, information sharing, vaccine development and rollout, or anything else. The pandemic has demonstrated yet again that we are “better together”. In the realm of healthcare, I support any measure that ensures that we do not work in silos and that barriers are not created in the provision of healthcare that prevent seamless co-operation throughout the UK. This will become ever more important as roles change, technology advances and services develop

We particularly need to ensure a UK approach to data gathering and healthcare statistics, as set out in Amendment 305. The disparities do not just present a barrier to consumers of healthcare—the public: voters, indeed—and their understanding and ability to evaluate standards of care in their area, as my noble friend Lady Morgan just illustrated. The lack of interoperability of data has real and detrimental consequences for health research, patient care, and ensuring and promoting continuous improvement in healthcare. This is before we even consider inconvenience and inefficiency

My eldest daughter stands in danger of being caught out by the current unsatisfactory situation. As a student at the University of St Andrews, she had her first two Covid vaccinations in Scotland, recorded on the NHS Scotland app under her CHI number, which is the number that NHS Scotland uses to identify patients. By the time it came to her booster and third injection, she was working as a graduate trainee in London. She duly went along in December and queued at a drop-in centre for her booster. However, the two systems do not match, so nowhere can she now show her proof of having three doses of the vaccine—which might lead to some problems if she wants to go to the rugby, a nightclub or somewhere else where she has to show it; or if she wants to travel. The same situation has arisen for many students or others who regularly cross the borders of the United Kingdom for work, study or family reasons. For these reasons, I commend the Minister to look at initiatives such as patient-held records. After all, we should always remember that, importantly, this is the patient’s own data

Another challenge we faced at the beginning of the pandemic was when consultants across the four nations sought to identify who should be in the shielding categories. Ensuring that the right people with the right conditions were identified and then notified was made far more challenging by the disparity of health data for different populations. It is bad enough that primary care, secondary care and social care data do not speak to each other, but healthcare is far too important to be allowed to become a political football within the UK

The Prime Minister has put ensuring the viability and security of the union as one of his top priorities. We have heard the excellent recommendations of my noble friend Lord Dunlop, and many times in this Chamber we have been assured that the recommendations will be enacted by Ministers across government departments, so that decisions taken in Westminster and England that affect the devolved nations will be considered proactively, positively and constructively, and we can build mutual respect. This Bill and this moment are an ideal opportunity to put some of these principles into practice. What could be more positive and constructive than legislating for NHS England to ensure that this body considers the impact of its decisions on patient care in Scotland, Wales and Northern Ireland

Like Amendment 301, where better data will lead to greater transparency, the new clause proposed by Amendment 17, which aims to ensure that the Secretary of State publishes guidance on these matters, also goes some way to ensuring transparency, which is so important in the building of mutual respect. These amendments would ensure that those with different approaches and political views across the UK cannot simply manipulate the delivery of healthcare and sacrifice patient outcomes on the altar of division

Turning to Amendment 205, at the moment, if a treatment is available to patients in one of our bigger teaching hospitals—say, in London, Glasgow or Edinburgh—should that treatment not be available to anyone in the UK? I refer to my interests in the register, particularly as the chief executive of Cerebral Palsy Scotland. I recall that, when the procedure for children with cerebral palsy, known as selective dorsal rhizotomy, was first performed in the UK, it was available at first only in Bristol. However, NHS boards in Scotland were able to refer suitable patients on an ad hoc basis, with funding following the patient. This saved families having to raise around £80,000 to travel to the United States for the procedure—but it did not just help the families. The practice was able to ensure that good practice and learning were shared. Now, the procedure, pioneered in Bristol, is available in a number of areas across the UK. Specialist, life-saving cancer services are another example. I think of a recent case where a patient from Glasgow—a good friend of mine—was able to benefit from treatment in Liverpool, which was his only option for treatment in the UK. However, it is not just for rare procedures or difficult cases that this is applicable. I have often seen families of children with cerebral palsy from Belfast, Carlisle or Northumberland who wish to travel to Glasgow or Edinburgh for relatively routine but condition-specific input instead of having to travel to London. At the moment, as I said, these arrangements are made largely on an ad hoc basis rather than being broadly available. This is what Amendment 205 seeks to correct. The NHS is a great British institution. The clue is in the name: it is a national health service. Therefore, should access not apply right across the UK

I urge the Government to accept these amendments. I cannot see why they would not, as they will not only ensure better co-ordinated healthcare throughout our United Kingdom; they will ensure that patient care for all our citizens, wherever they live, is given due consideration, and they will clearly illustrate the importance that the UK Government place on the well- being of people right across the UK. I look forward to the response from the Minister."	0
gb56858	57d3a7aaa93d15259f938b41d5fb5880	M	"My Lords, Parliament is lucky to have a Bottomley in each House and I have the pleasure of calling them both friends. I will take the noble Lord’s suggestion about how we might have the debate that the Secretary of State has said we want to have about future funding back to the department. I welcome the fact that he is beginning to engage with it and look forward to having that debate with noble Lords across the House.


My noble friend makes two pertinent points on the basis of his considerable experience. As I said, it is not unusual for this much-loved, much-cherished national institution to attract political comment from all quarters from time to time. That is as it should be. We all do it from a position of wanting the best for the corporation and to ensure that it can survive and thrive for its next 100 years. My noble friend is right to reinforce the point that £3.7 billion from licence fee payers this year, at a time when people’s bills and costs of living are rising, is a fair settlement that enables the BBC to continue doing the excellent things that it does, but in a way that shows that it understands how businesses and households across the country are having to tighten their belts—looking at how they can do what they do more efficiently and get more bang for their buck."	0
gb52213	481d952b652b686b7b2571a820127606	F	I thank the Minister for her update and fully welcome the new Ask for ANI scheme. Residents in Pontypridd who have experienced domestic abuse will appreciate the issue being raised here today. As my hon. Friend the Member for Rochdale (Tony Lloyd) has said, tackling the root cause of domestic abuse requires a long-term strategy focused on interventions targeted towards the perpetrators. Will the Minister therefore confirm exactly what support the Home Office is providing and what conversations it is having with organisations working in this area?	1
gb28807	fb06a4cb715d2ff3a7d5db6c8b323c32	F	"It is a rare privilege to be allowed to make a valedictory speech, Mr Speaker. I have to admit that this is the first one I have ever had the opportunity to make in leaving a job; normally, there was a wee present and a drink in the local pub, so this certainly is an elevation beyond my expectations

The people of Stirling paid me the honour of electing me four times and I thank them sincerely for it. Placed at the heart of Scotland, it is a constituency made up of many different and vibrant communities, across an area the size of Luxembourg. It is the most northerly rural Labour seat in the United Kingdom. I am its first woman MP, and there is a little picture of me in the city’s Smith museum, overlooking the marble bust of a previous MP for the city, Campbell-Bannerman, who was against votes for women—I think people going into our Smith museum get the message

I want to echo the thanks of other hon. Members who have spoken highly of the staff of the Commons. From the moment I entered this place some 18 years ago, they have shown nothing but courtesy and service to me and other Members. Of course, I give a special thanks to my parliamentary staff, Graham, Heather, Aileen, Stephen, Rachel and Gerry, for their support and forbearance during my time in Parliament. I also thank my constituency party members and my trade union, the GMB

Like you, Mr Speaker, I came into this House in 1997. At that time, pupils in my area were being educated in schools where buckets were needed to catch the rain; we needed a new hospital; our sports facilities were not able to cope with the demands of an increasingly keep-fit society; and the long-held ambition of creating a national park had still not been realised. Yet, within a few years those schools had been replaced or refurbished; new sports halls were built; we had our own new hospital; and one of the most scenic areas in the country, the Trossachs, had become a national park. I make no apology for saying that all those things were completed or commissioned under Labour Administrations

I am going to pick out two or three highlights in this House for me. The first is the banning of handguns in 1997, and I hope there is never an attempt in this country to weaken that legislation. The second is the passing of the Civil Partnership Act 2004, because for me it was one of the most impressive House of Commons occasions, when people were prepared to put on the public record their own journey to accepting civil partnerships. That made such a contrast with the divisive and harsh debate about section 28 in the 1980s. The third was when, as Minister for Disabled People, I travelled to New York to sign the United Nations convention on the rights of people with disabilities on behalf of the UK Government, with a young disabled man, Miro Griffiths, at my side. I am sure the Leader of the House, as a former distinguished Minister for Disabled People, will appreciate the significance of that occasion. My regret about these past five years, however, is that some of the progress on disability rights has been seriously undermined, certainly in the eyes of disabled people themselves, by some of the very “radical”—I use the word advisedly—changes in our benefits system

I am the eldest of a family of four girls. I, along with my sisters Kathleen, Helen and Frances, and our parents, lived for the first six years of my life up a small Glasgow stair, in a tenement. We had a room and kitchen, and an outside toilet. Down here it would probably be called a “studio apartment with bijou facilities”. Moving to a Glasgow housing scheme, which had a proper bathroom, was an unbelievable step up for my hard-working parents. Their ambition for us as their daughters was that we would take advantage of an education system, and we all did. They left school at 14, whereas we took advantage of the education system, and our children thought that university was the way to improve their own education. It was the ambition of that post-war generation that things would be better for their families

Finally, I want to say a special thanks to my husband Len and my children Paul and Sarah, all three of whom have given me tremendous support. Mr Speaker, when I came into this House I was a “Blair’s babe”. I am pleased today to take leave of it as Orla and Seumas’s granny."	1
gb50933	dfcc29d7926c1b0f65469d9ea8cdb831	M	"Over the last decade, we have seen a shocking increase in poverty levels in the UK. In particular, child poverty has risen significantly and should be seen in no uncertain terms as a national crisis. The causes of this increase in poverty are clear: a decade of damaging policies implemented by Conservative Governments who have taken income away from the poorest in our society and redistributed wealth upwards, making the rich even richer

The scourge of child poverty is a disgrace to a society as rich as ours. In my constituency alone, 15,335 children live in poverty, and many of those children depend on free school meals so that they can go to school and receive the education they deserve. Across Birmingham, the number of pupils who rely on free school meals is higher than in many parts of the country, and that is due in no small part to the shocking levels of poverty that many families currently find themselves in. It is obvious that such poverty and the subsequent support needed by those families does not come to an end when the school term ends

These measures are essential to families in my constituency who are facing the full force of lost income due to the pandemic and the resultant recession. I have received a great many messages from constituents urging action on free school meals. I, along with my constituents, believe that extending free school meals over the school holidays for the period stated in the motion is the very least this Government can do to assist families in need

More needs to be done to ensure that no child in my constituency or the country at large goes to school hungry. I want to take this opportunity to raise the recommendations made by School Food Matters, the Food Foundation and many others regarding free school meals. I believe it is necessary to extend free school meals for all children in families receiving universal credit and to extend the holiday activity and food programme to all areas in England, to ensure that summer holiday support is available to all children receiving free school meals. The Healthy Start vouchers also need to be increased."	1
gb56278	7e9c2ba8885b84584d13bf3327b64f6b	M	"Will my hon. Friend give way?


It is slightly separate, as I am going back in my hon. Friend’s speech, but I thank her for giving way. She has taken many interventions, and I think she is doing a marvellous job. I want to go back to her point about specialists being able to prescribe versus GPs. I have a particular concern about the pressures on GPs at the moment, particularly coming out of the pandemic and the fact that there is such demand and such a backlog in the system. My concern is that this is a further complication that GPs would have to work through. Although I am not necessarily against the thrust of where we are going with today’s Bill, does she share the concern that GPs have a lot on already?"	0
gb55637	40f2320fd187618101fe746d8cf8fe12	F	"T1. If he will make a statement on his departmental responsibilities.


I warmly welcome my right hon. Friend’s work to bring together employers in the offender employment summit, and the significant investment that is to come. One more key element to addressing reoffending is the third sector. Will he join me in paying tribute to Sussex Pathways, which does such tremendous work for offenders pre and post release, so that they can make good on some of the opportunities afforded them in prison? What specific steps is the Department taking to connect women with employment and education opportunities?"	0
gb37065	60b7950dc351e7e01127d8ffb06010c3	F	"Absolutely. The fact that not only Members of this House but individuals such as the Independent Anti-slavery Commissioner are asking for this tells me that we need to do it.


Absolutely. I am so grateful for all the interventions, but I shall try to wrap up my speech

The point is that the refugee crisis—indeed, the care crisis in our own country; we do not have enough foster carers—is an opportunity for us to do some decent housekeeping on the systems and to find out what capacity we have and where local authorities can step forward and do more. There is of course a debate to be had about funding. I know that some councils have said they are stretched, and the capacity conversation will draw out the argument about whether the funding is sufficient

The majority of councils do not care where the children come from. I care that we take our fair share and help our neighbours in Europe, and I know that many other Members do, too. So that I am reassured by the Minister and do not press my new clause to a vote, I ask again: will the safeguarding strategy extend beyond the UK—that is, might it take into account refugees who may come here from Europe and further afield? Will the consultation results be made open to Parliament?"	0
