id	speaker	sex	text	label
gb46487	e945e413d593f2d9a3643eb0de63aa18	F	"My Lords, my noble friend Lady Chakrabarti’s question is about the Crown Prosecution Service for England and Wales, but I am going to take advantage of the debate that she has kindly secured to highlight some of the issues that we face in Scotland

The basic problems are similar. The police and the prosecuting bodies make public statements to encourage victims to come forward, stating that they will support women and men who have been subjected to rape or sexual assault. There has been an increase in reports to the police, but a decrease in the percentage of cases being prosecuted

In England and Wales, the CPS has been accused of dropping rape cases that appear weak. This failure has been described by the director of the Centre for Women’s Justice as a “human rights failure”. Article 3 of the Human Rights Act requires “effective” police investigation and prosecution of rape cases

In Scotland, the records show an increase in the number of reported rapes and attempted rapes, which were up 28% in 2016-17 and 20% in 2017-18. The percentage of cases that went on to be prosecuted went up slightly in 2016-17 but was still only 13.7% of complaints. In 2017-18, this fell to 10.1%. The percentage of reported cases that result in convictions is less than 5%. Nearly 20% of prosecuted cases end with a finding of “not proven”—I will come back to this later

There are two major differences between Scots law and the law in England and Wales. The first is the need for corroboration. As the noble Lord, Lord Carlile, said, this used to apply in England and Wales but continues in Scotland. The second is that a jury has a third verdict as well as guilty or not guilty: not proven. Both differences appear to have an impact on cases of rape and sexual assault

The requirement for corroboration of evidence in criminal cases is described as, “an ancient and highly distinctive feature of Scots criminal law”

It requires that each “essential” or “crucial” fact be corroborated by direct or circumstantial evidence. This requirement remains in place despite an extensive inquiry in 2011 by Lord Carloway which recommended its abolition. Research conducted for the report found that 58% of serious cases not pursued due to lack of corroboration would have had a “reasonable prospect of conviction” in England and Wales. The report concluded that, “the requirement for corroboration could … make it too difficult to prosecute certain offences, for example those typically committed in private (such as rape)”

There is one possible way of bringing a prosecution when there is no direct corroboration—the Moorov doctrine, stemming from a case in 1930. This was based on similar fact evidence, which could allow evidence from other offences to be used as corroboration. But that can add to the pressure put on complainants, as their cases are dependent on other victims who may change their mind or may have a weaker case, which could result in a decision not to prosecute or an unsuccessful prosecution

The second handicap that can impact on successful prosecutions for rape and sexual assault is the option for a jury to find a case not proven, which has the same status in law as not guilty. Juries may use this when they consider that the accused may be guilty but insufficient evidence has been presented by the prosecution. The not proven verdict is used disproportionately in rape cases. Rape Crisis Scotland pointed out that nearly 30% of acquittals in rape and attempted rape cases were not proven, compared with 17% for all crimes and offences

I shall give two examples of how this has impacted on women. Emma reported a man who had raped and abused her when she was a child. The police explained to her that the key factor in determining whether to take forward a prosecution would be corroboration. Even though there was documentary evidence in social work and medical records, it was not sufficient, as there was no corroboration of each element of the charge. Although another family member had been abused, she did not want to become involved, so the Moorov doctrine could not apply. Emma believes that if the abuse had taken place in England, her abuser would have been prosecuted. Miss M was raped and her attacker was prosecuted, but the jury gave a not proven verdict. Last year she took her case to the civil courts and succeeded in establishing that she had been raped by the man she had accused. The sheriff accepted that the evidence was cogent, compelling and persuasive. She was, however, made to go through a second court case, at tremendous personal stress and financial cost

The corroboration requirements should have been abolished following the Carloway report in 2011. The recommendation to scrap it was supported by the Scottish Government, the Crown Office, Police Scotland and campaigners for victims of domestic violence and rape. But it was opposed by all the High Court judges in Scotland, other than Lord Carloway. One of the judges, Lord Cullen, stated: “It’s very important that”, corroboration, “is there and always has been for centuries as a safeguard against wrongful conviction”

Making particular reference to rape cases, the judges warned that, “the abolition of corroboration may result in miscarriages of justice”

But we can be sure that miscarriages of justice are happening regularly in a system where cases are not brought due to lack of corroboration

In 2014, the Lord Advocate, Frank Mulholland, stated: “In the past two years, 170 cases of rape have had no proceedings taken in them because of insufficient evidence, which in many instances is a lack of corroboration”

Another judge-led review into how sexual offences are dealt with in the Scottish criminal justice system is under way. This has been welcomed by Rape Crisis Scotland and other support and campaigning organisations, but we have to hope that, when it reports next year, it is followed by swift action to ensure fairness for the accused but also justice for women and men who have been subjected to rape or sexual assault

Will the Minister in his role as Advocate-General for Scotland lend whatever weight he can to encourage the abolition of the need for corroboration and an end once and for all of the use of the not proven verdict?"	1
gb59578	5516f0e5da8df3802355a0d3dd26370a	M	"I am happy to follow the Minister. Reference has been made to the oversight of the European Court of Justice. Although our primary concern about the protocol is in respect of trade between Great Britain and Northern Ireland, we do have a concern about the role of the European Court of Justice in respect of oversight, where there is a dispute between the United Kingdom and the European Union on matters pertaining to the protocol. We believe it is unfair and unreasonable that the European Court of Justice should be the final arbiter on such matters.


Indeed, and that speaks to the issue that I raised about the democratic deficit. The Government are endeavouring, through the Bill, to correct the flaws that were evident in the protocol. Although some in the House will point out that the Government signed up to the protocol, I welcome the fact that the Government recognise that the protocol is not working, that it is harmful to Northern Ireland and that changes need to be made. That is very important

We believe that the democratic deficit needs to be addressed. The European Union has so far shown an unwillingness to introduce proposals that would meet the United Kingdom’s concerns in that regard. We do not yet know whether there will be a change of heart, but in the absence of that, we are with the Government on this: we want a fair and reasonable system

I repeat what I have said throughout the Committee: if we set aside the process of how we got here and examine the detail of the Government’s proposals as a framework to provide solutions to the problems, I believe that that framework is fair. It respects the integrity of the EU single market and its right to protect that market. However, for us, it also fundamentally recognises and respects the United Kingdom’s right to protect the integrity of and to regulate its internal market. The protocol prevents the Government from doing that for the whole United Kingdom. Northern Ireland is currently subject to regulations that are introduced by the EU in a manner over which we have no say

Other Members have raised the fact that, at the moment, we do not have a fully functioning Assembly and Executive in Northern Ireland, yet I still do not see or hear an understanding from them of how that situation has arisen. It was with great reluctance that we took the decision to withdraw the First Minister back in February. It only happened after much delay; I stood on the green outside this building and was mocked by the hon. Member for Foyle (Colum Eastwood) for not having followed through on the warning that I had given to withdraw the First Minister. He goaded us, saying that we had not followed through, and he sits on these Benches now and attacks us for taking the decision that we warned we would have to take if progress was not made towards addressing the issues related to the protocol

I have also said, and reiterated during these debates, that as we make progress and as decisive action is taken by the Government in implementing this legislation, we will of course restore those political institutions, because we want them to work and function in the way that they were intended to. The hon. Members for Foyle and for Belfast South (Claire Hanna) seemed to suggest from a sedentary position that the concept of power sharing and consensus was not a fundamental principle of the Belfast agreement. I have to differ from them on that: I believe that power sharing is at the heart of the Belfast agreement and in the principle that, in a divided society such as Northern Ireland, we cannot have one side with all the power and others excluded from power. Therefore, the concept of power sharing was embraced by the political parties in Northern Ireland and has been the basis on which those political institutions have operated. However, if power sharing is to work, it requires cross-community consensus

I hear this new language from the SDLP, in particular, and also the Alliance party, who constantly talk about a “majority” of this and a “majority” of that. When Unionists had the majority, however, we were told that majority rule was anathema to the Alliance party and the SDLP—that we could not have a Unionist majority governing in Northern Ireland and there had to be cross-community consensus. However, when Unionists have concerns and issues and say that the cross-community consensus does not exist, our concerns are almost dismissed. Lip service is paid to them but, at every opportunity, there is opposition to reasonable change that would address Unionists’ concerns

I have not heard from the likes of the SDLP what the solution is, beyond saying, “Let’s have negotiations with the EU”. But negotiations have been tried—there have been 300 hours of negotiations. If the EU is prepared to come back to the table, change its negotiating mandate and act in good faith to get a solution that restores the cross-community consensus in Northern Ireland, bravo. But we see no inclination from the EU that it will do that

So what do we do? Do we sit back, rub our hands, say, “It’s all too difficult” and wait for the day when, hopefully, the EU will come riding over the hill and rescue the political stability in Northern Ireland, rescue the Belfast agreement and rescue the concept of power sharing on the basis of a cross-community consensus? That has not happened, despite the EU’s bold claims that the protocol was designed to protect the Good Friday agreement and the political institutions. Those institutions are not functioning precisely because there is not a cross-community consensus in support of the protocol

We need arrangements that reinstate and restore Northern Ireland’s place in the UK internal market, which respects the outcome of article 1 of the agreement—that Northern Ireland remains an integral part of the United Kingdom—as was recognised by the Irish Government and by the people of the Republic of Ireland, who voted in a referendum to change its constitution to recognise that Northern Ireland is part of the United Kingdom. I am afraid that the protocol has disrespected that constitutional settlement—that recognition that, for the time being, that is the settled will of the people of Northern Ireland. These issues are fundamentally important, and addressing the democratic deficit is important."	1
gb44068	31c70ceee442f75931b56beeaaed7c1b	M	"The Welsh economy has shown significant progress in recent years. The rate of employment in Wales is at a record high and increased by more than that in any other part of the UK over the last year, with 64,000 more people in work. There is a wealth of world-leading innovation in Wales, with Welsh businesses spending over £450 million on research and development in 2017.


I can tell the right hon. Gentleman that there is no greater champion for Wales than my right hon. Friend the Secretary of State. However, the hon. Gentleman raises a very serious and important point regarding Wylfa. This does affect the whole region. The Government were willing to offer a significant and generous package of potential support, but despite that, Hitachi decided that the project was still too great a commercial challenge. We are still committed to nuclear sites as part of the UK’s future energy mix, and we will also continue to support the Isle of Anglesey with initiatives such as the north Wales growth deal.


The hon. Lady makes an important point. We are certainly open-minded. Commitments such as this must be project-led. I reiterate that we recognise the significant impact that Hitachi’s decision will have on the region and planned investment, some of which could be co-dependent on the growth deal. We are committing £120 million, as the hon. Lady knows, and we will certainly talk to our partners in Wales. In fact, I am going there next week to talk with Ministers and stakeholders.


The hon. Lady raises an important point. We are certainly not abandoning that area of Wales. I reiterate that this was a commercial decision. We are committing £120 million to the north Wales growth deal, which we hope to get over the line as soon as practically possibly. The Government’s decision to agree to take an equity stake, to secure a strike price and to underwrite the debt on that project, was incredibly generous."	0
gb56767	18ba3a01bc6bac8b2fcb2d4e57658d3b	F	In 2017, the then Department for Communities and Local Government advised that it was actively looking at ways to take forward the issue of redundancy modification orders. To date, however, no updates have been provided—indeed, the Department no longer exists. Will the Leader of the House please assist me by contacting the relevant Department and urging it to meet me to provide an update? The long wait for an answer is having a detrimental effect on my constituent and on many others across the United Kingdom.	1
gb35199	451d501dbd80905ac2be5693ff06dd29	F	"I am very grateful to the Foreign Secretary and I welcome his update, particularly on the current situation in Mosul. I also take this opportunity to pay tribute to our servicewomen and men who put their lives at risk for our safety

The lives of 1.2 million civilians trapped in Mosul are indeed in grave danger. Their wellbeing is paramount, and no effort must be spared in ensuring that they are protected during the fighting and cared for in the aftermath; they suffered long enough during the two years of Daesh occupation

The Foreign Secretary recognises the challenges that face Mosul. Will he confirm what contingency plans have been made to support an exodus from Mosul, which has long been predicted by the UN and by aid agencies on the ground

On Syria, the Foreign Secretary speaks of liberating Raqqa. I appreciate that he does not wish to provide a timetable, but will he confirm that there is in fact a plan in place to do that? He has often said that he is working with the Syrian High Negotiations Committee. However, that appears to be at cross purposes with the Ministry of Defence, which is providing military support to the Syrian democratic forces, which were excluded from opposition talks in Riyadh by the HNC less than a year ago. Will the Foreign Secretary explain that contradiction? The Foreign Secretary refers to the resumption of training of vetted members of Syrian opposition groups. One year ago, the US-led $500 million training programme of moderate Syrian opposition forces was suspended by President Obama because of its total failure to produce any competent soldiers. Will the Foreign Secretary explain what has changed on the ground since then to lead the Government to believe that the results will be any different now? He is on record as stating that it is only when the fighting and bombing stops that we can hope to deliver the political solution, but we need to see real evidence of progress in this direction as a matter of urgency."	1
gb33706	cf9b89836419235eb59ebab820c5cda9	M	"My Lords, I welcome most warmly the contents of the gracious Speech, and I congratulate the Government. I was glad to see the commitment to secure the long-term future of Britain’s nuclear deterrent and to invest in Britain’s Armed Forces. In my view, our military capabilities have been reduced to the absolute minimum consistent with maintaining our national security. I understand that the commitment to bring forward a British Bill of Rights includes a period of consultation before such a Bill is drafted. If I were the Government Chief Whip in another place, I would advise the Prime Minister to ensure that the consultation was exceptionally thorough, with no short cuts of any sort

On the question of the European referendum, I have seen the surveys showing that the people of this country are less knowledgeable about the EU than those of any other country. After more than a quarter of a century in the other place, that finding does not surprise me, but it places a great responsibility on those on both sides of the argument to put forward fact-based and pragmatic visions of the future for this country either inside or outside the EU, speculative as some of them will be

Like my noble friend Lord King of Bridgwater in his excellent speech proposing the humble Address, I trust—I hope that that is not too strong a word—that the arguments will in future be conducted with courtesy and respect. The absence of those qualities not only devalues the case being made but brings discredit on those concerned and lowers the reputation of the body politic in the eyes of the public. It is said that people have short memories—I do not—but I hope that it is not too late for us to up our game

I am as irritated as the next man by aspects of the EEC, but the agreement or settlement reached by the Prime Minister, the implementation of which is conditional on our remaining in the European Union, is very much in our national interest and justifies the Government in asserting that the UK has passed the high watermark of integration into the EU. Some say that the settlement is not, as the Government and EU Governments believe, an international agreement binding in international law. To them I would say that were this narrowly held view to be valid—I do not think it is—we should look ahead a year or two

The five Presidents said some months ago that towards the end of the present decade, presumably after the French and German elections, there will be an intergovernmental conference to seek, inter alia, to improve the arrangements for managing the euro. If we remain in the EU, nothing can be agreed without our concurrence. We shall be in a position of very substantial leverage. The British Government have said that there are still many ways in which the EU needs to improve. The task of reforming the EU does not end with the settlement. But if we vote to leave the EU, not only does the settlement, with all its benefits, fall by the wayside, but we shall have no further say in any European arrangements whatever, many of which will affect us. This seems to be at variance with common sense

Last week, the United States Government complained of an “unsafe interception” by Chinese military aircraft of a routine US patrol in international airspace over the South China Sea. China claims most of the South China Sea, through which over $5 trillion of international trade passes by ship every year. The Philippines, Vietnam, Malaysia, Brunei and Taiwan also claim some of the hundreds of reefs and small islands in the sea. Since 2013, China has asserted its claims by reclaiming land around the Spratly Islands and stationing military assets on them, including long-range artillery. Tension is high, and the United States has accused China of militarising the South China Sea. The USA continues to send warships and aircraft through the South China Sea in what it describes as freedom-of-navigation operations intended to assert the right of free passage in international waters

The situation is tense and potentially dangerous, as is that in the Taiwan Strait, where China has threatened to invade if Taiwan declares independence. To us, the Spratly Islands dispute is currently a cloud no bigger than a man’s hand. It is arguable that we do not have a dog in the fight. However, a very substantial and growing part of our trade is with the Asia-Pacific region, as is that of a number of European countries. We have a vital interest in the situation. Militarisation is no way to settle territorial disputes in the modern world. I suggest that China is much more likely to listen to the voice of reason if it is that of the European Union, provided that the European Union has had no recent conversations with the Dalai Lama, rather than the UK alone. International influence is not some academic abstraction of concern only to diplomats but is essential for the protection and promotion of our national interests. Together, the European Union can exercise much more beneficial influence than the UK alone. We should be in there shaping that influence rather than pulling out and putting our heads under the bedclothes

Byron wrote in “Don Juan”: “There is a tide in the affairs of women, Which, taken at the flood, leads—God knows where”

I prefer Shakespeare’s version in “Julius Caesar”: “There is a tide in the affairs of men, Which, taken at the flood, leads on to fortune; On such a full sea are we now afloat, And we must take the current when it serves, Or lose our ventures”

Please let us not miss the tide again."	0
gb35360	6a455af99e0d3e153e84772ef64ac093	M	As the longest serving Fisheries Minister—the longest serving in history, I think—and with my Welsh connections, I warn the Minister that it would be a good idea to do as is suggested by the amendment but also to be extremely careful. The fisheries issue is going to be one of the most difficult that we face, because the fishing industry has been misled into believing that if you remove yourself from the common fisheries policy you are somehow perfectly free to do what you like. In fact, almost every fishery that we have is a common fishery with one other European nation, if not more. We are therefore going to have to deal with these things on a common fisheries policy basis anyway. It is thus crucial that our structure internally provides no possibility of any misunderstanding. I rather like this amendment because it removes what would otherwise be a misunderstanding. I hope that the Minister will understand and perhaps mention to his fellow Ministers that this is a long and hard row to hoe, if you can hoe rows in the sea. We will have to learn that we still have to live with each other even outside the European Union. Whatever you think about the policy, it is going to have to be common because there will be no other way of doing it. Therefore, getting it right internally will be crucial if we are to get it right externally, assuming that we continue with this disastrous policy.	0
